<?xml version="1.0" encoding="UTF-8"?>
<library lib_name="Old town library"
	xmlns:xsi="http://www.w3.org/2001/XMLSchema-instance"
	xsi:noNamespaceSchemaLocation="LibraryXSD.xsd">
	<book id="BN-2" type="Роман-эпопея">
		<title>Сегун</title>
		<author>Джеймс Клавелл</author>
	</book>
	<book id="BN-1" type="Сатирический роман">
		<title>Бравый солдат Швейк</title>
		<author>Ярослав Гашек</author>
	</book>
	<book id="BN-3" type="Роман">
		<title>Шамал</title>
		<author>Джеймс Клавелл</author>
	</book>
	<book id="BN-7" type="Информатика">
		<title>Java для начинающих</title>
		<author>Андрей Андреев</author>
	</book>
	<book id="BN-4" type="Роман-эпопея">
		<title>Война и мир</title>
		<author>Лев Толстой</author>
	</book>
	<book id="BN-5" type="Информатика">
		<title>Java полное руководство</title>
		<author>Герберт Шилдт</author>
	</book>
	<book id="BN-6" type="Информатика">
		<title>Java. Методы программирования</title>
		<author>Валерий Романчик</author>
		<author>‎Игорь Блинов</author>
	</book>
</library>
